<!ELEMENT setup (menubar)>
<!ELEMENT menubar (menu*)>
<!ELEMENT menu (menu*) >
<!ATTLIST menu title CDATA #REQUIRED>
<!ATTLIST menu action CDATA #IMPLIED>
<!ATTLIST menu params CDATA #IMPLIED>
